{
  "categoryId": "atc-cca",
  "id": "atc-scenario-0069",
  "name": "CCA 1432 避开强下沉气流",
  "declaredCardCount": 15,
  "cards": [
    {
      "id": "atc-scenario-0069-card-main-1181",
      "taskTitle": "CCA 1432-1",
      "audioText": "B: Your call sign is Air China 432, you are performing a flight from Guangzhou to Beijing, you are maintaining 5400 meters, over IKUBA, squawking 5655, make initial contact with Beijing Approach.",
      "audioTextZh": "B: 你的呼号是 Air China 432，执行 Guangzhou 到 Beijing 航班，保持 5400 米，过 IKUBA，应答机 5655，与 北京进近 建立初始联系。",
      "referenceText": "Beijing Approach, CCA1432, maintaining 5400 meters, over IKUBA, squawking 5655.",
      "referenceTextZh": "北京进近，CCA1432，保持 5400 米，过 IKUBA，应答机 5655。",
      "audio": "/question-bank-assets/audio/radiotelephony/main/1181.mp3"
    },
    {
      "id": "atc-scenario-0069-card-main-1182",
      "taskTitle": "CCA 1432-2",
      "audioText": "C: Air China 432, Beijing Approach, radar contact, climb to and maintain 6600 meters, contact Beijing Control on 118.2.",
      "audioTextZh": "C: Air China 432，北京进近，雷达识别，爬升并保持 6600 米，联系北京管制118.2。",
      "referenceText": "Climb to and maintain 6600 meters, 118.2, CCA1432.",
      "referenceTextZh": "爬升并保持 6600 米，118.2，CCA1432。",
      "audio": "/question-bank-assets/audio/radiotelephony/main/1182.mp3"
    },
    {
      "id": "atc-scenario-0069-card-main-1183",
      "taskTitle": "CCA 1432-3",
      "audioText": "B: Now you are maintaining 6600 meters, contact Beijing Control and request further climb.",
      "audioTextZh": "B: 现在你保持 6600 米，联系北京管制并请求继续爬升。",
      "referenceText": "Beijing Control, CCA1432, maintaining 6600 meters, requests further climb.",
      "referenceTextZh": "北京管制，CCA1432，保持 6600 米，请求继续爬升。",
      "audio": "/question-bank-assets/audio/radiotelephony/main/1183.mp3"
    },
    {
      "id": "atc-scenario-0069-card-main-1184",
      "taskTitle": "CCA 1432-4",
      "audioText": "C: Air China 432, negative due traffic, maintain 6600 meters.",
      "audioTextZh": "C: Air China 432，因交通原因不批准，保持 6600 米。",
      "referenceText": "Roger, maintain 6600 meters, CCA1432.",
      "referenceTextZh": "收到，保持 6600 米，CCA1432。",
      "audio": "/question-bank-assets/audio/radiotelephony/main/1184.mp3"
    },
    {
      "id": "atc-scenario-0069-card-main-1185",
      "taskTitle": "CCA 1432-5",
      "audioText": "C: Air China 432, climb to and maintain 8900 meters, turn left heading 210, fly direct to OBLIK.",
      "audioTextZh": "C: Air China 432，爬升并保持 8900 米，左转航向 210，直飞 OBLIK。",
      "referenceText": "Climb to and maintain 8900 meters, turn left heading 210, fly direct to OBLIK, CCA1432.",
      "referenceTextZh": "爬升并保持 8900 米，左转航向 210，直飞 OBLIK，CCA1432。",
      "audio": "/question-bank-assets/audio/radiotelephony/main/1185.mp3"
    },
    {
      "id": "atc-scenario-0069-card-main-1186",
      "taskTitle": "CCA 1432-6",
      "audioText": "B: During cruise, your weather radar observed a thunderstorm ahead, request turn right and state the reason.",
      "audioTextZh": "B: 巡航期间，你的气象雷达发现前方有雷暴，请求右转并说明原因。",
      "referenceText": "Beijing Control, CCA1432, our weather radar observed a thunderstorm ahead, request turn right.",
      "referenceTextZh": "北京管制，CCA1432，我们的气象雷达发现前方有雷暴，请求右转。",
      "audio": "/question-bank-assets/audio/radiotelephony/main/1186.mp3"
    },
    {
      "id": "atc-scenario-0069-card-main-1187",
      "taskTitle": "CCA 1432-7",
      "audioText": "C: Air China 432, negative due military activity, continue present heading for 20 miles.",
      "audioTextZh": "C: Air China 432，因军事活动不批准，继续当前航向 20 海里。",
      "referenceText": "Roger, continue present heading for 20 miles, CCA1432.",
      "referenceTextZh": "收到，继续当前航向 20 海里，CCA1432。",
      "audio": "/question-bank-assets/audio/radiotelephony/main/1187.mp3"
    },
    {
      "id": "atc-scenario-0069-card-main-1188",
      "taskTitle": "CCA 1432-8",
      "audioText": "B: Now you are clear of whether, report it to Beijing Control and request resume flight route.",
      "audioTextZh": "B: 现在你已脱离天气，向北京管制报告并请求恢复航路。",
      "referenceText": "Beijing Control, CCA1432, clear of whether, request resume flight route.",
      "referenceTextZh": "北京管制，CCA1432，已脱离天气，请求恢复航路。",
      "audio": "/question-bank-assets/audio/radiotelephony/main/1188.mp3"
    },
    {
      "id": "atc-scenario-0069-card-main-1189",
      "taskTitle": "CCA 1432-9",
      "audioText": "C: Air China 432, turn left heading 240 to rejoin Amber 461, climb and maintain 10100 meters.",
      "audioTextZh": "C: Air China 432，左转航向 240 重新加入 Amber 461，爬升并保持 10100 米。",
      "referenceText": "Turn left heading 240 to rejoin A461, climb and maintain 10100 meters, CCA1432.",
      "referenceTextZh": "左转航向 240 重新加入 A461，爬升并保持 10100 米，CCA1432。",
      "audio": "/question-bank-assets/audio/radiotelephony/main/1189.mp3"
    },
    {
      "id": "atc-scenario-0069-card-main-1190",
      "taskTitle": "CCA 1432-10",
      "audioText": "C: Air China 432, maintain 10100 meters, offset 10 miles left to avoid the reported strong downdraft.",
      "audioTextZh": "C: Air China 432，保持 10100 米，向左偏置 10 海里，以避让报告的强下沉气流。",
      "referenceText": "Maintain 10100 meters, offset 10 miles left to avoid the reported strong downdraft, CCA1432.",
      "referenceTextZh": "保持 10100 米，向左偏置 10 海里，以避让报告的强下沉气流，CCA1432。",
      "audio": "/question-bank-assets/audio/radiotelephony/main/1190.mp3"
    },
    {
      "id": "atc-scenario-0069-card-main-1191",
      "taskTitle": "CCA 1432-11",
      "audioText": "B: Now you are flying into a small cumulonimbus, contact Beijing Control and tell the controller you'd like to hold at Papa Echo Kilo VOR for weather improvement.",
      "audioTextZh": "B: 现在你正飞入一小块积雨云，联系北京管制，告诉管制员你想在 Papa Echo Kilo VOR 等待，等待天气好转。",
      "referenceText": "Beijing Control, CCA1432, we are flying into a small cumulonimbus, request hold at PEK VOR for weather improvement.",
      "referenceTextZh": "北京管制，CCA1432，我们正飞入一小块积雨云，请求在 PEK VOR 等待，等待天气好转。",
      "audio": "/question-bank-assets/audio/radiotelephony/main/1191.mp3"
    },
    {
      "id": "atc-scenario-0069-card-main-1192",
      "taskTitle": "CCA 1432-12",
      "audioText": "C: Air China 432, hold at Papa Echo Kilo VOR as published, when clear of weather, contact Beijing Approach on 119.25.",
      "audioTextZh": "C: Air China 432，按公布程序在 Papa Echo Kilo VOR 等待，天气解除后联系北京进近119.25。",
      "referenceText": "Hold at PEK VOR as published, when clear of weather, contact Beijing Approach on 119.25, CCA1432.",
      "referenceTextZh": "按公布程序在 PEK VOR 等待，天气解除后联系北京进近119.25，CCA1432。",
      "audio": "/question-bank-assets/audio/radiotelephony/main/1192.mp3"
    },
    {
      "id": "atc-scenario-0069-card-main-1193",
      "taskTitle": "CCA 1432-13",
      "audioText": "B: Now you are approaching RENOB, maintaining 4800 meters, you have got information Lima, contact Beijing Approach.",
      "audioTextZh": "B: 现在你接近 RENOB，保持 4800 米，已收到信息 Lima，联系北京进近。",
      "referenceText": "Beijing Approach, CCA1432, approaching RENOB, maintaining 4800 meters, information L.",
      "referenceTextZh": "北京进近，CCA1432，接近 RENOB，保持 4800 米，信息 L。",
      "audio": "/question-bank-assets/audio/radiotelephony/main/1193.mp3"
    },
    {
      "id": "atc-scenario-0069-card-main-1194",
      "taskTitle": "CCA 1432-14",
      "audioText": "C: Air China 432, Beijing Approach, radar contact, descend to and maintain 2400 meters, RENOB 2 Bravo arrival, expect ILS approach runway 01.",
      "audioTextZh": "C: Air China 432，北京进近，雷达识别，下降并保持 2400 米，RENOB 2 Bravo 进场，预计跑道 01 ILS 进近。",
      "referenceText": "Descend to and maintain 2400 meters, RENOB 2B arrival, expect ILS approach runway 01, CCA1432.",
      "referenceTextZh": "下降并保持 2400 米，RENOB 2B 进场，预计跑道 01 ILS 进近，CCA1432。",
      "audio": "/question-bank-assets/audio/radiotelephony/main/1194.mp3"
    },
    {
      "id": "atc-scenario-0069-card-main-1195",
      "taskTitle": "CCA 1432-15",
      "audioText": "C: Air China 432, turn right heading 330, descend to 900 meters, cleared ILS approach runway 01, report established.",
      "audioTextZh": "C: Air China 432，右转航向 330，下降到 900 米，可以跑道 01 ILS 进近，建立后报告。",
      "referenceText": "Turn right heading 330, descend to 900 meters, cleared ILS approach runway 01, report established, CCA1432.",
      "referenceTextZh": "右转航向 330，下降到 900 米，可以跑道 01 ILS 进近，建立后报告，CCA1432。",
      "audio": "/question-bank-assets/audio/radiotelephony/main/1195.mp3"
    }
  ]
}
