{
  "id": "opi-fzy-656",
  "name": "交通",
  "cards": [
    {
      "id": "opi-fzy-151978",
      "audio": "/question-bank-assets/revisions/opi/0caccfce455b8c6bb2d4b5a859de5eddc461cb451a15b1249abf9c566ce6ac0e/audio/opi/opi-fzy-151978.mp3",
      "audioText": "What's the traffic like in your hometown?",
      "studyTier": 1,
      "taskTitle": "Transportation/交通-4",
      "audioTextZh": "你家乡的交通状况如何？",
      "referenceText": "The traffic in my hometown is good/poor/terrible. It's too crowded.",
      "referenceTextZh": "我家乡交通状况很好/很糟糕。太拥堵了。",
      "audioDurationSeconds": 2.112
    },
    {
      "id": "opi-fzy-118205",
      "audio": "/question-bank-assets/revisions/opi/4084b98d0cf00d937771f2b28be4db8505f501561e9c628d5f6a7556db4125d5/audio/opi/opi-fzy-118205.mp3",
      "audioText": "Do you prefer public transportation or private transportation?",
      "studyTier": 0,
      "taskTitle": "Transportation/交通-12",
      "audioTextZh": "你喜欢公共交通还是私人交通呢？",
      "referenceText": "I prefer public transport because it's cheap and convenient for me. I enjoy the time to take a bus or subway in the city.\n\nIf I have a chance, I will choose to use private transport so that I don't need to walk a long way to the subway or a bus station, it's a waste of time. Besides, the public transport is overcrowded and I really feel uncomfortable in it.",
      "referenceTextZh": "我喜欢公共交通，便宜方便，我很享受在市区里乘坐公交或地铁的时光。\n\n如果有机会，我一定选择私人交通方式出行，这样我就不用走很长的路到地铁或公交车站了，很浪费时间。此外，公共交通太拥挤了，我觉得非常不舒服。",
      "audioDurationSeconds": 3.72
    },
    {
      "id": "opi-fzy-118206",
      "audio": "/question-bank-assets/revisions/opi/08fb0762ce405b54eb70f242f0db4079f5cdcc298b3ac8a77a0bf76e05034f7d/audio/opi/opi-fzy-118206.mp3",
      "audioText": "Can you tell me how to get the airport from here?",
      "studyTier": 0,
      "taskTitle": "Transportation/交通-13",
      "audioTextZh": "你能告诉我从这儿怎么到机场吗？",
      "referenceText": "It's not very far from here to the airport. Drive straight along the road, and then turn right at the first traffic light, then you will see the airport signs ahead. It takes about 10 minutes by car.",
      "referenceTextZh": "这儿离机场不远，沿着路一直往前开，在第一个红绿灯右转后，你会看到前方有机场指示牌。大约开车需要10分钟左右。",
      "audioDurationSeconds": 2.52
    },
    {
      "id": "opi-fzy-118199",
      "audio": "/question-bank-assets/revisions/opi/d28d0515d536c280aa4d2b16e9e57850e8f7091400b2c344bcfefdf553bbf63e/audio/opi/opi-fzy-118199.mp3",
      "audioText": "How did you come here today?",
      "studyTier": 0,
      "taskTitle": "Transportation/交通-1",
      "audioTextZh": "你今天怎么来这儿的？",
      "referenceText": "I came here by plane/ bus/ taxi/ car/ on foot.",
      "referenceTextZh": "我坐飞机/公共汽车/出租车/开车/步行来的。",
      "audioDurationSeconds": 1.56
    },
    {
      "id": "opi-fzy-151977",
      "audio": "/question-bank-assets/revisions/opi/a54d87492f0d3b99d3bac3670ad53dc58e5ba2fbabebdf908b2138bc86524fca/audio/opi/opi-fzy-151977.mp3",
      "audioText": "How did you come to the test center today?",
      "studyTier": 1,
      "taskTitle": "Transportation/交通-2",
      "audioTextZh": "你是怎么来考试中心的？",
      "referenceText": "I came here by driving a car/by taxi/ by bus/ on foot/ by plane.",
      "referenceTextZh": "我开车/乘坐出租车车/坐公交/步行/坐飞机过来的。",
      "audioDurationSeconds": 2.256
    },
    {
      "id": "opi-fzy-118204",
      "audio": "/question-bank-assets/revisions/opi/26258992895ab2005f8e24b9c9ad983bde82f1a4570a0a732d3375fe904c3244/audio/opi/opi-fzy-118204.mp3",
      "audioText": "Do you like to take public transport?",
      "studyTier": 0,
      "taskTitle": "Transportation/交通-11",
      "audioTextZh": "你喜欢乘坐公共交通工具吗？",
      "referenceText": "Yes, it's really a smart/convenient/fast way to take public transport, because, you know, there are many modern public transportations in our city now, for example, taxi, subway, bus, high-speed train, and airplane. No matter where I will go, I can always find the cheapest way from the public transportation.\n\nNo, compared with public transport, I would rather drive my own car, for it's too crowded to take the public transport.",
      "referenceTextZh": "是的，乘坐公共交通出行确实很不错/方便/快捷。你知道目前在我们城市里面有很多现代的公共交通方式，出租车，地铁，公交，高铁，还有飞机，不管我去哪儿，我总能找到最便宜的公共交通出行方式。\n不，相较于公共交通而言，我更喜欢自己开车，乘坐公共交通出行太拥挤了。",
      "audioDurationSeconds": 2.256
    },
    {
      "id": "opi-fzy-151981",
      "audio": "/question-bank-assets/revisions/opi/167d42dd73641e11431c654e96a93a87471735f632c51754f280fa61cf4dca63/audio/opi/opi-fzy-151981.mp3",
      "audioText": "Have you ever been abroad? Which place do you want to visit most?",
      "studyTier": 1,
      "taskTitle": "Transportation/交通-10",
      "audioTextZh": "你出过国吗？你最想去的是什么地方？",
      "referenceText": "Yes, I have been to Japan./No, I haven't been abroad, I want to go to the United States, because I want to see the NBA games.",
      "referenceTextZh": "是的，我曾经去过日本。/没有，我最想去美国，因为想去看一场NBA比赛。",
      "audioDurationSeconds": 3.72
    },
    {
      "id": "opi-fzy-151979",
      "audio": "/question-bank-assets/revisions/opi/7fe183f2b037161e2e308d9f2b944adbcba638307d44ef3203fdae41e955542e/audio/opi/opi-fzy-151979.mp3",
      "audioText": "What's your favorite means of transportation?",
      "studyTier": 1,
      "taskTitle": "Transportation/交通-6",
      "audioTextZh": "你最喜欢的交通方式是什么？",
      "referenceText": "My favorite is train/subway/bus.",
      "referenceTextZh": "我最喜欢的是火车/地铁/公交。",
      "audioDurationSeconds": 2.352
    },
    {
      "id": "opi-fzy-151980",
      "audio": "/question-bank-assets/revisions/opi/efe29e0f3a2f4a2dca88b5961052d63679b3ece4f6b9f7dcaeda545c5a54bae3/audio/opi/opi-fzy-151980.mp3",
      "audioText": "Do you think purchasing a car is necessary in your hometown?",
      "studyTier": 1,
      "taskTitle": "Transportation/交通-8",
      "audioTextZh": "你觉得在你的家乡有必要买车吗？",
      "referenceText": "Yes, I think so, it will be more convenient.\nNo, I don't think so, because it's too crowded.",
      "referenceTextZh": "是的，我觉得有必要，这样会更方便。\n我认为没必要，因为太堵了。",
      "audioDurationSeconds": 3.36
    },
    {
      "id": "opi-fzy-118201",
      "audio": "/question-bank-assets/revisions/opi/bdc682a2f4734f4596cb2c1c17e8b6fc99816105652a3e4b7e2e72cf61a52b86/audio/opi/opi-fzy-118201.mp3",
      "audioText": "Do you think purchasing/buying a car is necessary for you?",
      "studyTier": 0,
      "taskTitle": "Transportation/交通-5",
      "audioTextZh": "你觉得有没有必要买车呢？",
      "referenceText": "Yes, absolutely, because the public transport in my city is not very developed, so it's necessary to have my own car.\n\nNo, not really. Because we have public transportation in my city, like bus, subway, so it's very convenient to go everywhere.",
      "referenceTextZh": "绝对有必要，因为我所在的城市的公共交通不太发达，所以有必要买辆车。\n\n没太大必要，因为我所在的城市有公交/地铁，去哪儿都很方便。",
      "audioDurationSeconds": 3.168
    },
    {
      "id": "opi-fzy-118202",
      "audio": "/question-bank-assets/revisions/opi/bdeab4606af7de89951673b9cc0d94d1278e55dcfc3449ca49a57250aef0f073/audio/opi/opi-fzy-118202.mp3",
      "audioText": "What's your favorite means of transportation/ form of transport?",
      "studyTier": 0,
      "taskTitle": "Transportation/交通-7",
      "audioTextZh": "你最喜欢的交通方式是什么？",
      "referenceText": "Well, I like subway most, because it's very fast, and often arrives on time, so you don't have to worry about being late.\n\nMy favorite form of transport is driving car. Because with my own car, I can go out whenever I need to. It's convenient and time-saving.",
      "referenceTextZh": "嗯，我最喜欢坐地铁。因为地铁很快，而且通常都很准时，不用担心会迟到。\n\n我最喜欢的交通方式是开车。因为开自己的车，我可以什么时候想出去就出去，很方便，而且节约时间。",
      "audioDurationSeconds": 3.504
    },
    {
      "id": "opi-fzy-118200",
      "audio": "/question-bank-assets/revisions/opi/8be683f7ebcb4cf569270d8616185be9e49c63d36ee1f0e7672d8d08c2f0af5e/audio/opi/opi-fzy-118200.mp3",
      "audioText": "Can you drive a car?",
      "studyTier": 0,
      "taskTitle": "Transportation/交通-3",
      "audioTextZh": "你会开车吗？",
      "referenceText": "Yes, I can. I got my driver's license last year.\n\nNo, I can't. I plan to get the license next year.",
      "referenceTextZh": "我会开车，我去年拿到驾照的。\n\n不会，我打算明年考驾照。",
      "audioDurationSeconds": 1.176
    },
    {
      "id": "opi-fzy-118203",
      "audio": "/question-bank-assets/revisions/opi/f536221c9b7966cc5eb52395bb7c92a95f36945e195c0dcd66878651b69aa85d/audio/opi/opi-fzy-118203.mp3",
      "audioText": "How do you go to work everyday? How long does it take?",
      "studyTier": 0,
      "taskTitle": "Transportation/交通-9",
      "audioTextZh": "你每天都是怎么去上班的？要花多长时间？",
      "referenceText": "I go to work by car/ bicycle / airport shuttle bus every day. It takes me about half an hour to go to work.",
      "referenceTextZh": "我每天开车/骑自行车/坐机场大巴去上班，大约要花半个小时。",
      "audioDurationSeconds": 3.264
    }
  ],
  "declaredCardCount": 13,
  "categoryId": "opi-category-07"
}
